{
  "tenant_id": "11111111-1111-4111-8111-111111111111",
  "run_id": "22222222-2222-4222-8222-222222222222",
  "kind": "trigger",
  "state": "queued",
  "version": 1,
  "spec": {
    "name": "demo"
  },
  "result": null,
  "created_at": "2026-06-24T13:30:00Z",
  "updated_at": "2026-06-24T13:30:05Z"
}
